ID,Text
189_UK_DocF_V1_Ventilation,The actual equivalent area and location of installed background ventilators should be recorded.
190_UK_DocF_V1_Ventilation,c.  Checks should be made to determine that the background ventilator controls work and that they open and close correctly.
191_UK_DocF_V1_Ventilation,d.  The quality of the installation of the ventilator product should be checked to ensure it is correctly mounted within the wall or window aperture.
192_UK_DocF_V1_Ventilation,c.  That any runon timers are set to at least 15 minutes.
193_UK_DocF_V1_Ventilation,Ducted systems.
194_UK_DocF_V1_Ventilation,"4.7  For all ductwork and terminals, the following checks should be made and the results recorded in the checklist in Appendix C.4.8  For continuous mechanical ventilation systems, such as continuous mechanical extract ventilation or mechanical ventilation with heat recovery, the system should be balanced to achieve design air flow rates at each room terminal."
195_UK_DocF_V1_Ventilation,The fan manufacturers instructions should be followed when balancing the system.
196_UK_DocF_V1_Ventilation,"If specific details are not available from the manufacturer, the relevant set of instructions from subparagraphs (a) to (e) below should be followed."
197_UK_DocF_V1_Ventilation,The fan speed should be set to achieve the desired continuous flow rate.
198_UK_DocF_V1_Ventilation,The index terminal flow rate should be set with the terminal fully open and all other terminals should be adjusted to achieve the required flows at each terminal.
199_UK_DocF_V1_Ventilation,"If the total flow rate cannot be achieved through all the terminals, then the fan speed should be increased."
200_UK_DocF_V1_Ventilation,"If all the terminals have to be set to a significantly closed position to achieve the required air flow rate, then the fan speed should be reduced and the terminals rebalanced."
201_UK_DocF_V1_Ventilation,The fan should be set at a speed that will approximately achieve the desired continuous flow rate.
202_UK_DocF_V1_Ventilation,The index terminal flow rate should be set with the terminal fully open and all other terminals should be adjusted to achieve the required flows at each terminal.
203_UK_DocF_V1_Ventilation,"If the index terminal has to be set to a significantly closed position to achieve the required air flow rate, then the fan speed should be reduced and the terminals rebalanced."
204_UK_DocF_V1_Ventilation,"c.  For fixed terminals with flow adjustment by duct damper or a similar device at the fan unit, the guidance in subparagraphs (a) or (b) above should be followed, depending on the type of fan speed control."
205_UK_DocF_V1_Ventilation,The fan speed should be set to achieve the desired continuous flow rate.
206_UK_DocF_V1_Ventilation,The index terminal flow rate should be set with the terminal fully open and all other terminals should be adjusted to achieve the required flow rates at each terminal.
207_UK_DocF_V1_Ventilation,"Care should be taken not to close the terminals too far, because the fan unit will always maintain a constant volumetric flow rate."
208_UK_DocF_V1_Ventilation,"e.  For fixed terminals with automatic flow adjustment at the fan unit, the fan speed should be set to achieve the desired continuous flow rate."
209_UK_DocF_V1_Ventilation,Air flow rate testing.
210_UK_DocF_V1_Ventilation,4.9  The air flow rate of all mechanical ventilation fans should be tested.
211_UK_DocF_V1_Ventilation,4.10  A calibrated air flow device with a proprietary hood should be used to measure the air flow rates at each room terminal following the procedure detailed below.
212_UK_DocF_V1_Ventilation,The design air flow rates should be determined in accordance with Table 1.2.
213_UK_DocF_V1_Ventilation,Both of the following should be confirmed.
214_UK_DocF_V1_Ventilation,c.  Air flow measurements should be performed using an air flow device that complies with all of the following.
215_UK_DocF_V1_Ventilation,d.  The air flow for each extract/supply fan or terminal should be recorded in litres per second (l/s) on the commissioning sheet (see Part 3 of Appendix C).
216_UK_DocF_V1_Ventilation,"If so, evidence should be provided to assure the building control body that the flow rate can be determined by following the manufacturers guidance."
217_UK_DocF_V1_Ventilation,Controls.
218_UK_DocF_V1_Ventilation,4.11  The correct operation of each control function should be tested where it is practical.
219_UK_DocF_V1_Ventilation,Ventilation.
220_UK_DocF_V1_Ventilation,controls should be inspected to ensure that the following have been achieved.
221_UK_DocF_V1_Ventilation,"4.12  If manual controls are provided, clear and detailed instructions should be given to the occupier as part of the information package described in paragraphs 4.13 to 4.17."
222_UK_DocF_V1_Ventilation,Operating and maintenance instructions.
223_UK_DocF_V1_Ventilation,4.13  Sufficient information about the ventilation system and its maintenance requirements must be given to the building owner to allow the system to be operated effectively.
224_UK_DocF_V1_Ventilation,"The information should be provided in a clear manner, for a nontechnical audience."
225_UK_DocF_V1_Ventilation,4.14  A copy of the completed commissioning sheet in Appendix C should be given to the owner of the dwelling.
226_UK_DocF_V1_Ventilation,"Information should also be provided to suggest when, and how, the system components should be cleaned and maintained."
227_UK_DocF_V1_Ventilation,4.16  The following information should be provided where relevant.
228_UK_DocF_V1_Ventilation,That background ventilators allow fresh air into the home and should be left open.
229_UK_DocF_V1_Ventilation,e.  How cleaning and maintenance of the system and its components should be carried out.
230_UK_DocF_V1_Ventilation,"f.  How to access ducts for cleaning, how to undertake cleaning of plant and ducts and the intervals at which cleaning should be undertaken."
231_UK_DocF_V1_Ventilation,Home User Guide for new dwellings.
232_UK_DocF_V1_Ventilation,"4.18  A Home User Guide should be provided for a new dwelling as described in Section 9 of Approved Document L, Volume 1: Dwellings."
233_UK_DocF_V1_Ventilation,"Where the system provides more than one function, the owner should be informed of each separate function."
234_UK_DocF_V1_Ventilation,Additional information for work in existing dwellings.
235_UK_DocF_V1_Ventilation,"4.20 When new ventilation is installed in an existing dwelling, information about it should be provided to the building owner in accordance with paragraphs 4.13 to 4.17."
236_UK_DocF_V1_Ventilation,Extract ventilation may be by natural means or by mechanical means (e.g.by an extract fan or a centralsystem).
237_UK_DocF_V1_Ventilation,A design air permeability lower than 5m3/(hm2) at 50Pa.
238_UK_DocF_V1_Ventilation,An as-built air permeability lower than 3m3/(hm2) at 50Pa.
239_UK_DocF_V1_Ventilation,"Material change of use Defined in regulation 5 as:  Where there is a change in the purposes for which or the circumstances in which a building is used, so that after that change:a.  the building is used as a dwelling, where previously it was not;b.  the building contains a flat, where previously it did not; c.  the building is used as an hotel or a boarding house, where previously it was not;d.  the building is used as an institution, where previously it was not;e.  the building is used as a public building, where previously it was not;the building is not a building described in classes 1 to 6 in Schedule 2, where previously it g.  the building, which contains at least one dwelling, contains a greater or lesser number of dwellings than it did previously;h.  the building contains a room for residential purposes, where previously it did not;the building, which contains at least one room for residential purposes, contains a greater or lesser number of such rooms than it did previously;the building is used as a shop, where it previously was not; ork.  the building is a building described in regulation 7(4)(a), where previously it was not."
240_UK_DocF_V1_Ventilation,"For the purposes of this approved document, natural ventilation refers to a ventilation strategy using background ventilators and intermittent extract ventilation."
241_UK_DocF_V1_Ventilation,"Permanent opening An opening between rooms or floors that has no means of closing it, e.g."
242_UK_DocF_V1_Ventilation,an openstairwell or two rooms that have been joined byremoving part of a wall.
243_UK_DocF_V1_Ventilation,Purge ventilation may be provided by natural means (e.g.
244_UK_DocF_V1_Ventilation,an openable window) ormechanical means (e.g.
245_UK_DocF_V1_Ventilation,a fan).
246_UK_DocF_V1_Ventilation,Ventilation The supply and removal of air (by natural and/or mechanical means) to and from a space or spaces in a building.
247_UK_DocF_V1_Ventilation,"This ratio, in steadystate conditions, is numerically equal to the equilibrium relative humidity of the air, except that the latter is commonly expressed as a percentage."
248_UK_DocF_V1_Ventilation,Performance criteria for dwellings.
249_UK_DocF_V1_Ventilation,B2  The performance criterion for moisture is that there should be no visible mould on the inner surfaces of the external walls of a properly heated dwelling with typical moisture generation.
250_UK_DocF_V1_Ventilation,"B3  Mould can grow whether the dwelling is occupied or unoccupied, so the performance criterion for humidity (given in Table B3) should be met at all times, regardless of whether there are occupants."
251_UK_DocF_V1_Ventilation,"Even if the designer and builder choose to reduce volatile organic compound (VOC)  levels in dwellings by controlling them at source, the ventilation requirements must still be met."
252_UK_DocF_V1_Ventilation,Public Health Englands Indoor Air Quality Guidelines for Selected Volatile Organic Compounds (VOCs) in the UK should be used.
253_UK_DocF_V1_Ventilation,"For the purposes of this approved document, for all dwellings (both new and existing, where Part F applies), the moisture criteria are likely to be met if, during the colder months of the year, the moving average surface water activity of the internal surfaces of external walls is always less than the value in Table B2, evaluated over each moving average period."
254_UK_DocF_V1_Ventilation,"B11  For new dwellings, for the purposes of this approved document, the moisture criteria in Table B2 is likely to be met if, during the colder months of the year, the moving average relative humidity in a room is always less than the value given in Table B3, evaluated over each moving average period."
255_UK_DocF_V1_Ventilation,Checking design air flow rates against measured air  flow rates.
256_UK_DocF_V1_Ventilation,"C2  Measured air flow rates for all fans should be recorded on Part 3: Commissioning details, as part of the commissioning procedures given in Section 4 of this approved document."
257_UK_DocF_V1_Ventilation,The measured values should be compared with their respective design values to determine the following.
258_UK_DocF_V1_Ventilation,"If the measured rate for each fan is equal to or greater than the design value, then the system meets the design standard."
259_UK_DocF_V1_Ventilation,"If any measured value is lower than the design value, an adjustment should be made to correct the system."
260_UK_DocF_V1_Ventilation,"If necessary, further adjustments should be made until all air flows match their design values."
261_UK_DocF_V1_Ventilation,Demonstrating compliance.
262_UK_DocF_V1_Ventilation,C3  All three parts of the installation and commissioning checklist should be completed.
263_UK_DocF_V1_Ventilation,The relevant sections of Parts 2 and 3 should be signed by a person who is both competent to install the system and responsible for installing and commissioning the system.
264_UK_DocF_V1_Ventilation,C4  The threepart form should be completed for each installation address.
265_UK_DocF_V1_Ventilation,"A copy should be submitted to the building control body as evidence that the system has been correctly installed, inspected and commissioned."
266_UK_DocF_V1_Ventilation,The relevant section of this checklist should be selected depending on the ventilation strategy selected.
267_UK_DocF_V1_Ventilation,"NOTE: Although it may go beyond the standards of paragraph 3.6, following the checklist in Table D1 is considered to be an adequate means of demonstrating compliance with the minimum standards of requirement F1(1) as described in paragraph 3.6."
